{
  "$schema": "https://json-schema.org/draft/2020-12/schema",
  "$id": "https://sdkwork.com/schemas/sdkwork-workflow.schema.json",
  "title": "SDKWork GitHub Workflow Configuration",
  "description": "Application-level configuration consumed by the SDKWork reusable GitHub Actions packaging workflow.",
  "type": "object",
  "additionalProperties": false,
  "required": ["schemaVersion", "app", "release", "targets"],
  "properties": {
    "$schema": {
      "type": "string",
      "minLength": 1
    },
    "schemaVersion": {
      "const": "2026-06-06.sdkwork.workflow.v1"
    },
    "app": {
      "type": "object",
      "additionalProperties": false,
      "required": ["id", "repository"],
      "properties": {
        "id": {
          "type": "string",
          "pattern": "^[a-z0-9][a-z0-9._-]*$"
        },
        "name": {
          "type": "string",
          "minLength": 1
        },
        "repository": {
          "type": "string",
          "pattern": "^[A-Za-z0-9_.-]+/[A-Za-z0-9_.-]+$"
        },
        "sourcePath": {
          "type": "string",
          "minLength": 1
        },
        "configPath": {
          "type": "string",
          "minLength": 1
        }
      }
    },
    "release": {
      "type": "object",
      "additionalProperties": false,
      "required": ["artifactPrefix"],
      "properties": {
        "artifactPrefix": {
          "type": "string",
          "pattern": "^[a-z0-9][a-z0-9-]*$",
          "description": "Lowercase kebab artifact prefix used as the first segment of every GitHub workflow artifact name."
        },
        "defaultVersion": {
          "type": "string",
          "pattern": "^[0-9A-Za-z][0-9A-Za-z._+-]*$"
        },
        "versionInput": {
          "type": "string",
          "pattern": "^[A-Za-z_][A-Za-z0-9_]*$"
        },
        "tagInput": {
          "type": "string",
          "pattern": "^[A-Za-z_][A-Za-z0-9_]*$"
        },
        "channelInput": {
          "type": "string",
          "pattern": "^[A-Za-z_][A-Za-z0-9_]*$"
        },
        "changelog": {
          "type": "object",
          "additionalProperties": false,
          "description": "GitHub Release notes and changelog generation policy.",
          "properties": {
            "enabled": {
              "type": "boolean"
            },
            "source": {
              "enum": ["auto", "app-manifest", "file", "git", "none"],
              "description": "auto reads sdkwork.app.config.json release.notes, then CHANGELOG.md, then git commit subjects."
            },
            "path": {
              "type": "string",
              "minLength": 1,
              "description": "Safe relative changelog markdown path when source is file."
            },
            "includeCommitSubjects": {
              "type": "boolean"
            },
            "maxCommitSubjects": {
              "type": "integer",
              "minimum": 1,
              "maximum": 200
            }
          }
        }
      }
    },
    "dependencies": {
      "type": "array",
      "items": {
        "type": "object",
        "additionalProperties": false,
        "required": ["id", "repository"],
        "properties": {
          "id": {
            "type": "string",
            "pattern": "^[a-z0-9][a-z0-9._-]*$"
          },
          "repository": {
            "type": "string",
            "pattern": "^[A-Za-z0-9_.-]+/[A-Za-z0-9_.-]+$"
          },
          "ref": {
            "type": "string",
            "minLength": 1
          },
          "refInput": {
            "type": "string",
            "pattern": "^[A-Za-z_][A-Za-z0-9_]*$"
          },
          "path": {
            "type": "string",
            "minLength": 1
          },
          "tokenSecret": {
            "type": "string",
            "const": "SDKWORK_RELEASE_TOKEN"
          },
          "submodules": {
            "enum": [false, true, "false", "true", "recursive"]
          }
        }
      }
    },
    "toolchains": {
      "type": "object",
      "additionalProperties": false,
      "properties": {
        "node": {
          "type": "string"
        },
        "pnpm": {
          "type": "string"
        },
        "python": {
          "type": "string"
        },
        "java": {
          "type": "string"
        },
        "go": {
          "type": "string"
        },
        "rust": {
          "type": "string"
        },
        "flutter": {
          "type": "string"
        },
        "dotnet": {
          "type": "string"
        },
        "android": {
          "type": "boolean"
        },
        "xcode": {
          "type": "boolean"
        },
        "wix": {
          "type": "string"
        }
      }
    },
    "lifecycle": {
      "type": "object",
      "additionalProperties": false,
      "properties": {
        "preflight": {
          "$ref": "#/$defs/steps"
        },
        "install": {
          "$ref": "#/$defs/steps"
        },
        "build": {
          "$ref": "#/$defs/steps"
        },
        "stage": {
          "$ref": "#/$defs/steps"
        },
        "package": {
          "$ref": "#/$defs/steps"
        },
        "sign": {
          "$ref": "#/$defs/steps"
        },
        "sbom": {
          "$ref": "#/$defs/steps"
        },
        "validate": {
          "$ref": "#/$defs/steps"
        },
        "deploy": {
          "$ref": "#/$defs/steps"
        },
        "publish": {
          "$ref": "#/$defs/steps"
        }
      }
    },
    "targets": {
      "type": "array",
      "minItems": 1,
      "items": {
        "type": "object",
        "additionalProperties": false,
        "required": ["id", "profile", "platform", "architecture", "formats", "runner", "outputGlobs"],
        "properties": {
          "id": {
            "type": "string",
            "pattern": "^[a-z0-9][a-z0-9-]*$",
            "description": "Canonical target id. Single-format targets use <platform>-<architecture>-<profile>-<format-token>, except linux deb/rpm targets use linux-<distribution>-<architecture>-<profile>-<format-token>. Multi-format targets use <platform>-<architecture>-<profile>."
          },
          "packageId": {
            "type": "string",
            "pattern": "^[a-z0-9][a-z0-9-]*$",
            "description": "Optional explicit package id. When present it must match the canonical package id for a single-format target."
          },
          "profile": {
            "enum": ["server", "desktop", "mobile", "tablet", "web", "worker", "library"]
          },
          "platform": {
            "enum": ["linux", "windows", "macos", "ios", "ipados", "android", "android-tablet", "windows-tablet", "web", "container"]
          },
          "distribution": {
            "enum": ["debian", "ubuntu", "rhel", "centos", "fedora", "opensuse", "suse"],
            "description": "Linux distribution family for native deb/rpm packages. Required for linux deb/rpm targets and omitted for generic linux archive formats."
          },
          "architecture": {
            "enum": ["x64", "arm64", "armv7", "universal", "wasm32", "noarch"]
          },
          "variant": {
            "type": "string",
            "pattern": "^[a-z0-9][a-z0-9-]*$",
            "description": "Optional package variant such as cpu, nvidia-cuda, or amd-rocm. When present it is inserted between profile and format in the canonical package id."
          },
          "formats": {
            "type": "array",
            "minItems": 1,
            "items": {
              "enum": [
                "zip",
                "tar.gz",
                "deb",
                "rpm",
                "pkg",
                "dmg",
                "msi",
                "msix",
                "exe",
                "appimage",
                "snap",
                "flatpak",
                "docker",
                "oci",
                "helm",
                "apk",
                "aab",
                "ipa",
                "web",
                "static",
                "jar",
                "war"
              ]
            },
            "uniqueItems": true
          },
          "runner": {
            "type": "string",
            "minLength": 1
          },
          "outputGlobs": {
            "type": "array",
            "minItems": 1,
            "items": {
              "type": "string",
              "minLength": 1
            }
          },
          "environment": {
            "type": "string"
          },
          "signing": {
            "type": "boolean"
          }
        }
      }
    },
    "security": {
      "type": "object",
      "additionalProperties": false,
      "properties": {
        "oidcRequired": {
          "type": "boolean"
        },
        "artifactAttestations": {
          "type": "boolean"
        },
        "sbomRequired": {
          "type": "boolean"
        },
        "signingRequired": {
          "type": "boolean"
        }
      }
    },
    "publish": {
      "type": "object",
      "additionalProperties": false,
      "properties": {
        "workflowArtifact": {
          "type": "boolean"
        },
        "githubRelease": {
          "type": "boolean"
        },
        "aggregateRelease": {
          "type": "boolean",
          "description": "When true, package jobs upload workflow artifacts and a final publish job downloads them, runs lifecycle.publish, renders notes, and uploads the aggregated release assets."
        },
        "aggregateArtifactPath": {
          "type": "string",
          "minLength": 1,
          "description": "Safe relative directory used by the aggregate publish job when downloading package artifacts."
        },
        "aggregateUploadGlobs": {
          "type": "array",
          "minItems": 1,
          "items": {
            "type": "string",
            "minLength": 1
          },
          "description": "File globs uploaded by the aggregate publish job after lifecycle.publish runs."
        },
        "retentionDays": {
          "type": "integer",
          "minimum": 1,
          "maximum": 90
        }
      }
    },
    "deployments": {
      "type": "array",
      "items": {
        "type": "object",
        "additionalProperties": false,
        "required": ["id", "environment"],
        "properties": {
          "id": {
            "type": "string",
            "pattern": "^[a-z0-9][a-z0-9._-]*$"
          },
          "environment": {
            "type": "string",
            "pattern": "^[A-Za-z0-9][A-Za-z0-9._-]*$"
          },
          "url": {
            "type": "string"
          },
          "runner": {
            "type": "string"
          },
          "profile": {
            "enum": ["server", "desktop", "mobile", "tablet", "web", "worker", "library"]
          },
          "platform": {
            "enum": ["linux", "windows", "macos", "ios", "ipados", "android", "android-tablet", "windows-tablet", "web", "container"]
          },
          "architecture": {
            "enum": ["x64", "arm64", "armv7", "universal", "wasm32", "noarch"]
          },
          "variant": {
            "type": "string",
            "pattern": "^[a-z0-9][a-z0-9-]*$"
          },
          "format": {
            "enum": [
              "zip",
              "tar.gz",
              "deb",
              "rpm",
              "pkg",
              "dmg",
              "msi",
              "msix",
              "exe",
              "appimage",
              "snap",
              "flatpak",
              "docker",
              "oci",
              "helm",
              "apk",
              "aab",
              "ipa",
              "web",
              "static",
              "jar",
              "war"
            ]
          },
          "targetId": {
            "type": "string",
            "pattern": "^[a-z0-9][a-z0-9-]*$"
          },
          "packageId": {
            "type": "string",
            "pattern": "^[a-z0-9][a-z0-9-]*$",
            "description": "Canonical package id selector. Linux native deb/rpm package ids include the distribution segment."
          },
          "lifecycle": {
            "enum": ["deploy", "publish"]
          }
        }
      }
    }
  },
  "$defs": {
    "steps": {
      "type": "array",
      "items": {
        "type": "object",
        "additionalProperties": false,
        "required": ["run"],
        "properties": {
          "name": {
            "type": "string",
            "minLength": 1
          },
          "run": {
            "type": "string"
          },
          "shell": {
            "enum": ["bash", "pwsh", "powershell", "sh", "cmd", "node"]
          },
          "workingDirectory": {
            "type": "string"
          },
          "env": {
            "type": "object",
            "additionalProperties": {
              "type": "string"
            }
          }
        }
      }
    }
  }
}
